301037,1,30,37,1,20,8,0,6,6,3,2,1,4,2,3,0,0,1,0,0,0,0,0,3,1,3,2,1,1,2,1,2,2,0,0,3010372,4,2,fear,My friend will find out that I am in love with her.,1
221077,1,22,77,2,20,2,0,6,6,9,2,3,2,3,3,1,2,1,0,0,0,0,3,3,2,3,1,1,0,2,1,1,2,0,1,2210772,2,3,fear,Speaking in front of a large group of people.,1
302077,1,30,77,1,23,8,0,5,4,2,2,4,4,4,1,0,0,1,0,0,0,0,0,1,1,3,3,1,1,1,0,0,0,1,0,3010772,4,4,fear,Going out alone in the dark.,1
302072,1,30,72,1,23,8,0,6,7,8,2,4,1,3,0,0,-1,1,0,0,0,0,0,1,1,3,3,1,1,5,1,1,2,0,0,3010722,1,3,fear,First time in anatomy.,1
221079,1,22,79,1,21,8,0,8,1,7,2,4,1,4,1,0,0,1,0,0,0,0,0,1,1,3,2,1,2,1,2,2,2,2,0,2210792,1,4,fear,"I overturned in a canoe a few years back and I didn't know how to swim. Although I had a life-jacket on I still panicked.",1
261005,1,26,5,2,21,4,1,9,1,1,2,4,3,4,2,0,0,1,0,0,1,0,0,2,1,3,0,2,1,1,0,0,2,0,1,2610052,3,4,fear,"That day I was alone at home after coming home from school.  I did not know where everyone else had gone, I kept waiting for them to come back and nobody came.  It was getting very late and I was terrified.",1
221080,1,22,80,1,20,2,1,7,1,6,2,1,4,3,1,1,0,1,0,0,0,0,0,2,2,3,3,2,0,1,1,1,0,0,1,2210802,4,3,fear,"I'm afraid of not being able to go to the school I want because of suffering grades.",1
302075,1,30,75,2,18,8,0,7,7,3,2,3,4,2,1,0,0,1,0,0,0,0,1,1,1,3,2,2,3,1,3,2,2,0,0,3010752,4,2,fear,Walking home in the dark from college.,1
221081,1,22,81,1,20,2,2,6,1,9,2,1,4,3,1,0,0,0,-1,0,0,0,0,3,3,3,1,3,3,5,1,1,0,0,0,2210812,4,3,fear,That I would do bad in a class and not get into Bus school.,1
261001,1,26,1,2,22,4,1,9,1,1,2,4,4,1,1,0,0,0,-1,0,0,0,0,2,2,3,2,1,1,3,1,3,1,0,0,2610012,4,1,fear,When my B.A results had not come.,1
302074,1,30,74,1,23,8,0,4,4,8,2,1,3,2,1,0,0,0,0,0,0,0,1,1,1,3,2,1,4,4,1,2,2,0,0,3010742,3,2,fear,Staying alone in the dark.,1
261002,1,26,2,2,22,4,1,7,7,1,2,3,4,3,1,1,0,0,-1,0,0,0,0,2,3,3,3,1,0,3,0,1,3,0,1,2610022,4,3,fear,"When I got to know that the friend I am closest to got engaged, and she was going away.  I was overjoyed for her, but also felt frightened as I was very emotionally dependent on her.  I did not know what I would do without her.",1
261003,1,26,3,2,23,4,1,7,1,1,2,2,2,2,1,0,0,2,-1,0,0,0,0,2,1,3,0,2,4,5,0,0,0,2,0,2610032,2,2,fear,"A few weeks back my daughter had very high fever and I was scared that it might lead to brain damage or convulsions.",1
302073,1,30,73,1,23,8,0,4,4,3,2,4,2,4,1,0,0,0,-1,0,0,0,1,1,1,3,2,1,4,2,1,2,2,0,0,3010732,2,4,fear,Earth crake.,1
261027,1,26,27,2,25,4,2,7,7,1,2,1,1,1,3,0,0,1,1,0,0,0,0,3,3,3,0,0,1,5,1,3,0,0,0,2610272,1,1,fear,"I was coming home from a relative's place and it was about 9.30/10 P.M.  I felt slightly apprehensive when I got off the bus and started walking towards my place.  I was confident that nothing would happen to me, yet there was this slight feeling of fear.",1
221078,1,22,78,1,20,8,2,0,1,7,2,3,1,3,2,0,0,1,0,0,0,0,0,2,2,3,0,0,4,1,0,0,0,0,0,2210782,1,3,fear,"On my second plane trip, we ran into unexpected turbulence.",1
301004,1,30,4,1,22,8,0,7,7,8,2,3,4,4,1,0,-1,1,0,0,0,0,3,3,1,3,3,2,1,2,1,1,1,0,0,3010042,4,4,fear,Telling my parents that I did not well in an examn.,1
261026,1,26,26,2,26,4,2,2,1,1,2,1,3,2,0,1,0,0,0,0,0,0,0,3,1,0,2,2,2,5,1,3,3,0,1,2610262,3,2,fear,"When I had to travel alone, unescorted for the first time.     It was an over-night journey by train to a distant place.",1
261042,1,26,42,1,21,4,2,7,1,1,2,0,0,0,0,0,0,0,0,0,0,0,0,0,0,0,0,0,0,0,0,0,0,0,0,2610422,0,0,fear,[ I have not felt this emotion yet.],1
261043,1,26,43,1,23,4,1,7,1,1,2,4,3,4,2,0,0,0,0,0,0,0,1,1,2,1,1,1,1,5,0,3,0,0,0,2610432,3,4,fear,"I was scared when I realized that I might miss the train which I was supposed to take.  I was 1500 Kilometres away from home and when  I heard the depart whistle I was still 150 feet away from the train.  I finally made it.",1
301007,1,30,7,1,18,8,0,5,5,1,2,4,1,4,3,0,0,2,0,0,0,0,0,1,1,3,2,1,1,5,1,2,2,0,0,3010072,1,4,fear,"Waking up from a bad dream in a dark night with noone else around.",1
261044,1,26,44,1,28,4,1,2,1,1,2,4,2,2,2,0,0,0,0,0,0,0,0,3,0,0,2,0,4,3,0,2,0,0,0,2610442,2,2,fear,"I was then in the 10th standard and was going to my native place.  The last bus had already left and so I started walking, it soon became quite dark.  The road was a village road and was deserted, I was not even sure if that was the right way.  I finally reached home at 10 P.M.",1
261045,1,26,45,1,23,1,1,2,2,1,2,1,4,3,0,0,2,1,0,1,0,0,0,2,2,3,3,2,2,5,2,1,2,2,0,2610452,4,3,fear,"One of my fellow students had bunked field work and in my attempt to cover up for him I myself was exposed, though not directly.  We were to meet our field work suprevisor and we were afraid of the consequences.",1
301006,1,30,6,1,21,8,0,5,4,8,2,2,3,3,2,0,2,2,0,0,0,0,3,2,1,3,3,1,1,5,1,1,1,0,0,3010062,3,3,fear,Damaged the tap in the residental Hall.,1
261046,1,26,46,1,29,4,1,7,1,1,2,2,3,3,0,1,0,1,0,0,0,0,0,3,1,3,2,1,1,5,2,2,2,0,1,2610462,3,3,fear,"A few weeks back I had a very important seminar and I had circulated my papers to all the panel members.  A day before the seminar I realized that I had inadvertantly burdened certain       derivations and I had failed to correct it.  I feared that this    would reflect very badly on my performance.  Fortunately none of  the panel members detected it and I felt relieved.",1
301005,1,30,5,1,20,8,0,4,4,1,2,4,3,2,2,1,2,2,0,0,1,0,2,1,1,3,0,1,4,1,1,1,1,0,2,3010052,3,2,fear,"Lost my purse, the money in the purse belonged to my parents.",1
261041,1,26,41,1,27,1,1,9,7,1,2,4,4,4,1,0,0,1,0,0,1,0,0,2,1,3,0,0,2,5,3,1,1,3,1,2610412,4,4,fear,"When I was in my village one of my enemies had written a non-sense letter to a girl and he told the father of this girl that I was the culprit.  When I got to know this I was scared as  the girl's father was a worse man.",1
261048,1,26,48,1,22,4,2,4,4,1,2,4,3,3,1,0,0,1,0,0,0,0,0,1,2,2,2,1,4,5,0,3,2,2,0,2610482,3,3,fear,"At the age of 16 I had gone to see a film in a nearby village, about 8 kms  from my home.  I started walking as there was no bus.  I had to cross hills and as it was dark I could not identify the path.  Half way through it started raining and as there was no shelter I ran four kms to reach home.",1
301009,1,30,9,1,18,8,0,5,4,1,2,1,2,3,3,1,-1,1,0,0,0,0,0,2,1,3,2,1,1,5,1,3,3,0,1,3010092,2,3,fear,Could not find my way out in the college building at night.,1
261049,1,26,49,1,20,4,1,7,1,1,2,0,0,0,0,0,0,0,0,0,0,0,0,0,0,0,0,0,0,0,0,0,0,0,0,2610492,0,0,fear,[ Never experienced.],1
261050,1,26,50,1,23,4,1,9,1,1,2,4,4,4,1,0,0,0,0,0,0,0,0,2,1,3,0,3,1,1,3,0,0,0,0,2610502,4,4,fear,"I received a letter from my college telling me that I would not be allowed to sit for the exams because of my low attendance in class and the bad experience in the terminal exams.",1
301003,1,30,3,1,18,8,0,7,7,1,2,3,2,3,2,0,-1,0,0,0,0,0,0,2,2,3,3,1,4,1,1,2,2,0,0,3010032,2,3,fear,Before examination.,1
261051,1,26,51,1,28,1,2,0,1,1,2,4,4,4,0,0,-1,0,1,0,0,0,1,1,2,3,3,1,4,2,1,0,0,0,0,2610512,4,4,fear,"My illness a few years back.  I was sevely down with malaria and asthma, I had lost my health, charm and cheerfulness completely.",1
301002,1,30,2,1,21,8,0,7,7,8,2,3,1,2,2,0,-1,2,0,0,0,0,0,1,1,0,2,1,4,2,1,1,2,0,0,3010022,1,2,fear,Walking on a dark street with noone around.,1
261052,1,26,52,1,20,4,1,7,0,1,2,3,3,3,0,0,0,1,0,1,0,0,0,3,1,3,1,2,2,1,0,1,1,0,0,2610522,3,3,fear,"When I did not get admission in M.Sc after my B.Sc, I felt really bad.  When I started my journey to Bombay, after having accepted my uncle's offer to come to Bombay, I was afraid, wondering if I  would succeed or not.",1
261053,1,26,53,1,20,4,1,7,1,1,2,4,2,3,2,0,-1,0,0,0,0,0,0,1,1,3,0,1,4,1,0,2,0,0,0,2610532,2,3,fear,"Once I was very frightened at night as I had a very fearful and terrifying dream, I could not go back to sleep for a long time.",1
301001,1,30,1,1,20,8,0,7,5,1,2,4,4,2,2,0,-1,2,-1,0,0,0,2,2,1,3,2,3,3,4,2,2,1,0,0,3010012,4,2,fear,Fighting with class mates in Highschool.,1
221072,1,22,72,2,19,2,1,6,6,6,2,2,1,2,2,0,0,2,1,0,0,0,0,2,1,3,0,0,3,2,2,0,0,2,0,2210722,1,2,fear,"When I walked to church with my roommate, a bum told us to call the police and he started following us.",1
261047,1,26,47,1,20,4,1,7,1,1,2,4,4,2,1,1,0,0,0,0,0,0,0,2,1,2,1,0,3,1,1,2,3,0,1,2610472,4,2,fear,Before the declaration of the S.S.C results.,1
261034,1,26,34,2,21,4,1,2,1,1,2,3,1,4,0,0,-1,1,0,0,0,0,0,2,3,3,2,2,1,2,1,0,0,0,0,2610342,1,4,fear,"I felt afraid just before receiving the question paper of the part II exam.",1
261058,1,26,58,1,23,4,2,7,1,1,2,0,0,0,0,0,0,0,0,0,0,0,0,0,0,0,0,0,0,0,0,0,0,0,0,2610582,0,0,fear,[ Never.],1
261028,1,26,28,1,22,4,1,7,1,1,2,4,4,3,1,0,0,0,-1,0,0,0,0,3,1,3,3,3,2,3,3,1,1,1,0,2610282,4,3,fear,"I experienced fear when I was not prepared for the final year degree exams.",1
301017,1,30,17,1,20,8,0,4,4,1,2,3,4,3,1,0,-1,0,0,0,0,0,0,1,1,3,3,2,1,5,1,1,1,0,0,3010172,4,3,fear,Finding out that I am not an as able student as I thought.,1
261029,1,26,29,1,22,1,1,5,1,1,2,2,1,2,1,0,0,0,-1,0,0,0,0,2,1,3,0,0,0,3,0,1,0,0,0,2610292,1,2,fear,When I almost walked on a snake.,1
261030,1,26,30,2,26,4,1,9,0,1,2,0,0,0,0,0,0,0,0,0,0,0,0,0,0,0,0,0,0,0,0,0,0,0,0,2610302,0,0,fear,[ No response.],1
301016,1,30,16,1,21,8,0,7,6,1,2,3,2,2,0,0,-1,0,0,0,0,0,0,2,2,3,2,1,1,3,1,2,3,0,0,3010162,2,2,fear,Listening to horrot stories at night.,1
261031,1,26,31,2,26,4,1,2,1,1,2,3,2,2,1,0,0,0,0,0,0,0,0,3,0,3,1,1,3,4,0,0,2,0,0,2610312,2,2,fear,"When I was working in Delhi, I had gone alone to see the hostel where I would be residing.",1
301015,1,30,15,1,20,8,0,7,7,1,2,4,1,4,3,0,-1,0,-1,0,0,0,0,3,1,3,2,1,1,2,1,1,2,0,0,3010152,1,4,fear,Facing a mad dog.,1
261032,1,26,32,1,24,4,1,7,7,1,2,4,1,3,1,0,0,0,0,0,0,0,0,1,1,3,2,0,4,5,0,0,2,1,0,2610322,1,3,fear,"Once when I was walking alone at mid-night, I happened to put my foot on a frog, as it felt smooth I thought that it was a snake  and I felt afraid. �",1
301008,1,30,8,1,21,8,0,7,6,8,2,3,1,4,2,0,0,0,-1,0,0,0,0,1,1,3,2,1,2,5,1,2,3,0,0,3010082,1,4,fear,Left alone in the dining hall at night.,1
301014,1,30,14,2,21,0,0,7,6,8,2,4,2,3,3,1,-1,1,0,0,1,0,0,1,1,3,2,1,1,1,1,2,2,0,2,3010142,2,3,fear,Walking alone in the dark in a strange street.,1
301018,1,30,18,2,21,8,0,6,5,8,2,4,4,4,1,0,0,0,0,0,0,0,0,3,2,3,3,1,1,5,1,1,2,0,0,3010182,4,4,fear,"Just arrived in the university, not knowing anybody.",1
301013,1,30,13,1,21,5,2,4,4,1,2,2,1,2,3,1,-1,1,0,0,0,0,0,1,1,3,1,1,1,5,1,3,2,0,1,3010132,1,2,fear,Left alone in the dark in a big building.,1
261035,1,26,35,1,25,4,2,0,0,1,2,0,0,0,0,0,0,0,0,0,0,0,0,0,0,0,0,0,0,0,0,0,0,0,0,2610352,0,0,fear,[ I do not recall one here either.],1
261036,1,26,36,2,22,4,1,9,1,1,2,4,4,4,3,0,-1,2,0,0,0,0,0,3,2,3,1,3,1,2,1,3,3,1,0,2610362,4,4,fear,"Fear is an emotion that I experience very often.  Naturally this is during exams and subsequently while waiting for the results.  However there is one occassion when I was paralyzed with fear.  This was when I was doing my M.A.-I, and we had a series of student lectures.  I was one of the participants and my lecture happened to be the opening lecture.  I had been confident all morning, about twenty minutes before the lecture, my confidence started failing me.  I felt my heart go cold, my lips go dry and I was really paralyzed.  This incident of fear is still fresh.",1
301012,1,30,12,2,22,8,0,7,4,8,2,1,1,3,2,0,0,1,0,0,0,0,0,1,2,3,2,1,1,5,1,2,2,1,0,3010122,1,3,fear,Going to the examn not well prepared.,1
261037,1,26,37,2,26,4,1,7,1,1,2,4,4,4,4,2,2,1,-1,0,0,0,0,3,1,3,3,3,3,2,3,1,1,1,2,2610372,4,4,fear,"This was when I was being followed home every day from the campus, by a stranger.  He would follow me to the campus and then sit outside my class.  If I was not there he would ask my friends as to where I was.  He was a dark, ominous looking person and I was terrified of him as I did not know his intentions.  I reported him to the security officer, who turned him over to the police.  I was even more petrified then.",1
261038,1,26,38,1,23,4,1,7,1,1,2,4,1,2,0,0,0,0,0,0,0,0,0,2,2,1,1,1,4,4,1,3,3,0,0,2610382,1,2,fear,"When I had gone to a school picnic and was left behind in the forest.",1
301010,1,30,10,2,22,8,0,6,4,8,2,4,2,3,2,0,-1,1,0,0,0,0,1,1,1,3,2,1,1,1,1,2,2,1,0,3010102,2,3,fear,Getting lost in a strange place.,1
261039,1,26,39,1,28,4,1,2,1,1,2,4,3,3,1,0,0,0,0,0,0,0,0,3,1,3,0,3,1,2,1,1,0,0,0,2610392,3,3,fear,"As a child, one evening I had read a novel about ghosts and I had thus spent a sleepless night as I kept feeling that there were ghosts dancing around me.",1
261040,1,26,40,1,23,4,1,4,4,1,2,3,4,4,3,0,2,4,-1,1,0,0,2,3,3,3,0,2,1,5,2,1,3,2,0,2610402,4,4,fear,"One day, early morning my mother who is healthy fell ill.  There was no doctor or compounder near by and for a few hours -8 A.M to 6 P.M she did not speak a single sentence, nor did she drink water or  milk.  There was no movement in her body and I felt really scared.  I almost lost my confidence about her survival.",1
261033,1,26,33,2,33,4,0,7,1,1,2,4,4,4,1,0,0,1,0,0,1,0,0,1,1,3,0,0,1,5,2,1,2,0,1,2610332,4,4,fear,"When my son fell off the cot at the age of 5 months, I became very nervous and thought that it would cause defects in his head.",1
201053,1,20,53,1,19,2,2,6,6,2,2,4,4,3,0,0,0,0,0,0,0,0,0,0,1,3,1,2,0,4,1,2,3,0,0,2010532,4,3,fear,When I was told that the form five results were out.,1
331052,1,33,52,2,28,2,2,4,0,1,2,4,2,2,0,0,0,0,0,0,0,0,0,2,1,3,3,1,4,5,0,1,2,0,0,3310522,2,2,fear,"A boy phoned me at night and wanted to talk to me for 30 minutes outside.  I thought that he would reveal what he felt and would question me on our relationship.  I treated him as a friend and did not want any misunderstandings.  Therefore I refused to meet him and told him that I would see him the coming day.  I was very unhappy as I feared having hurt him and got him into trouble.",1
201042,1,20,42,1,25,2,2,8,1,2,2,4,1,3,2,1,0,1,0,0,0,0,0,1,1,3,0,1,0,3,1,2,0,1,1,2010422,1,3,fear,When a thunder belt hit the roof top of the building I was in.,1
331046,1,33,46,2,24,7,1,7,7,1,2,3,4,3,2,1,0,1,0,1,0,0,0,3,2,0,2,1,1,1,2,3,2,3,1,3310462,4,3,fear,"I found a problem in homework which would not get solved although I tried my best.",1
201050,1,20,50,1,20,8,2,6,7,2,2,3,1,4,3,0,-1,0,0,0,0,1,0,3,1,3,0,3,4,5,3,1,0,0,0,2010502,1,4,fear,"I felt very frightened when a robber broke into our house and threatened to shoot my father if he did not part with some money.  I was looking at the man with his hand on the trigger.",1
331061,1,33,61,2,26,1,1,9,7,1,2,3,4,4,1,0,0,0,1,0,0,0,0,2,3,3,1,2,0,1,1,0,3,0,0,3310612,4,4,fear,"On Christmas eve,1984, I had just finished the exams and was afraid as the results of one of my major subjects had been very unsatisfactory.  I thought that I had only a 50% chance of passing.  Even if I failed this subject I would not need to repeat.  However I liked this subject very much and my results were bad because of my lazyness.  If I was forced to change to a minor in this subject I would be very unwilling.",1
201037,1,20,37,2,21,2,1,6,7,1,2,4,2,4,4,0,-1,0,0,0,0,0,0,0,2,3,0,0,4,1,3,0,0,0,0,2010372,2,4,fear,"Birds had made nests in our thatched roof and they were flying and flapping their wings in the bedroom at night.  It was very dark and I could not even see my nose.  I did not know that it was the birds till my mother told me so.",1
201057,1,20,57,1,24,6,1,2,1,9,2,4,1,2,4,1,0,1,0,0,0,0,0,3,1,3,2,1,1,5,1,2,2,2,1,2010572,1,2,fear,When I met an elephant in the bush.,1
331055,1,33,55,2,26,2,2,0,1,1,2,4,1,1,0,0,0,0,1,0,0,0,0,3,1,3,2,1,1,2,1,3,3,0,0,3310552,1,1,fear,"I did not do well in one of the subjects last term.   I was afraid that I would fail.  My result was a grade D, though it was not good I still passed.  I felt more comfortable then.",1
201034,1,20,34,2,30,1,1,6,6,8,2,3,2,2,2,0,0,0,0,0,0,0,0,1,1,3,3,3,0,1,0,2,2,0,0,2010342,2,2,fear,"I was sleeping when I heard the neighbours screaming, I peeped through the window and saw a thief  trying to enter my neighbour's house.",1
331049,1,33,49,2,23,8,2,5,8,1,2,4,3,4,1,0,0,0,0,0,0,0,0,0,0,0,0,0,0,0,2,1,1,0,0,3310492,3,4,fear,"At noon one Sunday I received a phone call telling me that my mother had been knocked down by a car at the street crossing and that her husband should go and see her.  I could not believe this as my father and my mother had gone out together to buy lunch boxes.  However I immediately ran to the scene of the accident.",1
331044,1,33,44,2,25,2,1,6,1,1,2,3,1,0,3,1,2,2,0,0,1,0,0,2,1,3,2,1,0,3,1,2,2,2,2,3310442,1,0,fear,"When I was young I got lost on the street and the police found me after a day.",1
201048,1,20,48,2,19,2,1,4,1,2,2,2,4,4,4,0,-1,1,0,0,0,0,0,1,1,3,0,3,3,4,3,1,0,1,0,2010482,4,4,fear,"When thieves broke into our neighbour's house and later we heard gunshots.",1
201062,1,20,62,2,20,7,1,4,1,5,2,4,4,4,2,0,-1,2,0,1,0,0,0,1,1,3,0,1,4,1,0,3,0,2,0,2010622,4,4,fear,"My father had been involved in a car accident two years ago.  I was then very scared thinking that he would die as he lay unconscious in hospital for two weeks.",1
201040,1,20,40,2,20,1,1,2,1,2,2,3,4,2,3,0,0,0,1,0,0,0,0,3,3,3,2,0,1,4,2,1,2,0,0,2010402,4,2,fear,"When I first came to the UNZA I did not know the kind of people I would find here and the kind of behaviour they would have towards me.",1
331050,1,33,50,1,25,7,1,0,1,1,2,3,4,2,2,1,0,1,1,0,0,0,0,3,1,3,0,0,3,5,1,0,0,0,1,3310502,4,2,fear,"One camping night, I listened to the ghost stories told by my classmates.",1
201044,1,20,44,2,21,2,2,4,1,1,2,4,4,4,4,0,0,1,-1,0,0,0,1,3,1,3,3,1,3,2,2,1,1,2,0,2010442,4,4,fear,"I was caught doing something I was not supposed to do.  I did something with the person who caught me (bribe) and even though he promised not to report me, I am still frightened.",1
201058,1,20,58,1,21,2,2,2,8,9,2,3,2,3,0,0,-1,0,0,0,0,0,0,1,2,3,2,1,2,2,2,2,2,0,0,2010582,2,3,fear,When I was walking around all alone at night.,1
331062,1,33,62,2,21,2,1,7,7,1,2,1,1,3,2,0,2,1,0,1,0,0,0,2,1,3,2,0,0,2,0,0,0,1,0,3310622,1,3,fear,"My parents were out and I was the eldest at home.  At midnight a male stranger phoned us and spoke to me in a rough language.  I hung up and heard someone walking outside our door.",1
201039,1,20,39,1,23,6,2,8,1,3,2,3,4,2,1,0,0,1,-1,0,0,0,0,1,2,2,1,2,3,3,1,3,2,0,0,2010392,4,2,fear,After having taken an exam i feared having failed it.,1
201041,1,20,41,2,19,6,1,8,8,9,2,3,4,4,1,1,0,1,1,0,0,0,0,2,1,3,0,0,4,1,0,3,3,2,1,2010412,4,4,fear,"When my little sister was sick at home and I thought that she would die.",1
201056,1,20,56,2,20,2,1,8,1,2,2,2,4,3,0,0,-1,1,0,0,0,0,0,2,2,3,2,0,4,4,0,1,0,1,0,2010562,4,3,fear,"My uncle was taken to the UTC for an operation as he had cancer.  There had been a lot of deaths of late - 3 out of every 4 operated.  I was scared for my uncle's life.",1
201051,1,20,51,2,20,6,1,4,6,5,2,3,1,4,3,2,0,1,1,0,0,0,0,1,3,3,2,1,1,2,1,2,2,0,2,2010512,1,4,fear,"I went home late one evening and saw that the security lights were off.  I got inside the gate and just then I realized that the dogs may be outside.",1
201046,1,20,46,1,22,6,2,2,1,1,2,2,1,4,1,0,-1,2,1,0,0,0,1,3,1,3,3,3,3,5,2,3,2,2,0,2010462,1,4,fear,"When I was confronted by a policeman one night around 11 o'clock.  I was afraid when they threatened to take me and my girl to the gallows.",1
201035,1,20,35,1,24,6,1,6,1,3,2,3,2,4,4,0,2,2,1,0,0,0,2,1,1,3,1,0,4,2,2,3,1,0,0,2010352,2,4,fear,"I had gone for a medical check-up at the U.T.H and failed to make it back on time for the C119 practical sessions at 1400 hours last academic year.",1
201038,1,20,38,2,28,6,1,8,1,8,2,4,1,4,4,2,0,2,1,0,0,0,1,1,1,3,0,0,0,5,3,0,2,3,2,2010382,1,4,fear,"When I came back from work one day, the friends of my son told me that he had not come back from school and that he was lost.",1
331054,1,33,54,1,28,2,2,9,6,1,2,4,3,3,2,0,0,0,0,0,0,0,0,1,2,3,2,0,3,3,0,2,0,2,0,3310542,3,3,fear,"After listening to ghost stories with my classmates I had to back alone to the hostel at night.  I had to walk through a long and quiet road and I was scared of meeting a ghost.",1
331051,1,33,51,2,23,2,2,0,7,1,2,4,1,4,3,0,2,2,0,0,1,0,1,1,1,3,3,3,2,1,2,1,0,3,1,3310512,1,4,fear,"After seeing a horror film - Omen.  I could not sleep at night  even though I closed my eyes.  The last scene of the film kept coming back to me, I seemed to hear the girls in the film shouting at the devil.  The devil did not have any expression on his face and I thought that he would choose me.",1
331060,1,33,60,2,20,7,1,5,7,1,2,4,3,2,1,0,0,0,0,0,0,0,0,3,2,3,3,0,2,1,1,2,2,0,0,3310602,3,2,fear,"It was a week before the higher level results were announced.  I had tried and failed many times and this was the last time that I was taking the exam.  I knew that if i failed again I woulld have to enter the society.  I imagined things during this period - I dreamt that I had entered university and it was a nice experience.  When I thought about the future, an unexplainable fear rose in me.  I feared being a worker and not having a bright prospect, I also feared the criticism of my relatives as my brother had gone to university.  Whenevr I thought of this issue I could not eat or concentrate, and my heart beat increased.",1
201045,1,20,45,1,29,6,1,5,1,5,2,4,3,3,1,0,0,0,0,0,0,0,0,1,1,3,0,0,4,4,0,0,0,0,0,2010452,3,3,fear,"I was a passenger in a vehicle when suddenly another vehicle came from behind to overtake us.  However another one was coming right in front so the other vehicle changed course and blocked our way and so we crashed against the side of the road.",1
331048,1,33,48,2,24,7,2,9,1,1,2,4,3,3,2,0,0,1,0,0,1,0,0,2,1,3,1,2,0,5,1,2,3,0,1,3310482,3,3,fear,"Once, when I was ten, I could not remember why my mother was so angry.  She fainted suddenly and I was very scared as I did not know what to do .",1
201055,1,20,55,1,22,8,2,2,1,9,2,4,1,3,1,0,0,0,0,0,0,0,0,2,1,3,0,3,4,4,3,0,0,0,0,2010552,1,3,fear,"Two guys were fighting murderously and I feared that one of them would be killed.",1
331045,1,33,45,2,22,2,1,4,6,1,2,3,3,1,1,0,0,1,0,0,0,0,0,3,1,3,2,0,2,1,3,2,2,0,0,3310452,3,1,fear,"One year, when I went to a camp, I was chased by a dog.  I tried hard and finally managed to escape from it.  My torch suddenly went off and we talked about ghost stories and I thought that there were ghosts.",1
201060,1,20,60,1,32,6,1,8,1,2,2,3,3,4,3,0,-1,1,0,0,0,0,0,3,1,3,0,3,3,1,3,1,1,0,0,2010602,3,4,fear,"When my neighbour's house was broken into and shots could be heard.",1
201047,1,20,47,1,20,2,2,6,1,5,2,4,2,1,1,0,0,1,1,0,0,0,0,3,1,2,2,1,1,2,1,3,2,1,0,2010472,2,1,fear,"When I was an exploration with my friends and almost got lost in an unfamiliar environment.  It was getting dark and we did not know how to get back home.",1
331043,1,33,43,2,20,2,2,9,1,1,2,3,1,1,1,0,-1,0,0,0,0,0,0,1,1,2,2,0,4,1,2,2,2,3,0,3310432,1,1,fear,"I was on a trip to Phillipines during Summer and I was staying in a hotel.  The room I was staying in was very silent and had very dim lights.  The last night I felt frightened and lay awake - I could hear some sounds around me and dared not open my eyes - I waited for dawn.",1
201059,1,20,59,2,22,2,1,6,8,1,2,2,3,4,4,0,-1,2,0,0,0,0,0,1,1,3,0,0,4,4,1,1,2,0,0,2010592,3,4,fear,When I had to walk along a dark road alone.,1
201032,1,20,32,2,30,1,1,6,1,8,2,2,3,4,3,0,0,3,0,0,0,0,1,2,2,3,3,3,3,2,3,2,0,1,0,2010322,3,4,fear,"We were driving at night and I realized that a car was following us.",1
201052,1,20,52,2,21,1,1,7,1,5,2,4,4,4,4,1,2,2,1,0,0,1,2,1,1,3,3,3,4,1,3,1,3,0,1,2010522,4,4,fear,"When I saw an accident, a woman was run over and she died on the spot.",1
201033,1,20,33,1,31,6,2,8,8,2,2,3,4,3,0,0,0,1,0,0,0,0,0,3,1,3,2,1,0,2,3,0,1,0,0,2010332,4,3,fear,"When I took blood from a patient for alcohol estimation and urine for some other examination, he told me that something bad would happen to me as he would play magic on me.",1
331057,1,33,57,2,21,2,2,7,0,1,2,1,4,3,1,2,0,3,1,0,0,0,0,3,2,3,3,1,1,2,2,1,2,2,2,3310572,4,3,fear,"At primary school the teacher caught me cheating during a dictation.",1
201054,1,20,54,1,20,6,2,4,8,9,2,3,4,4,1,0,0,0,-1,0,0,0,0,3,1,3,3,1,1,1,2,1,2,0,0,2010542,4,4,fear,"When I impregnated a certain girl, I thought that I would be forced to marry her or go to court.",1
201036,1,20,36,2,18,2,1,6,6,1,2,1,3,4,3,0,0,2,0,0,0,0,1,1,1,3,0,0,2,1,3,1,2,1,0,2010362,3,4,fear,"When a drunkard barged into a room where my friend and I had run in order to get away from him.  We were all alone and all I could see was this hand coming towards me.",1
201049,1,20,49,1,21,8,2,4,1,2,2,4,4,4,0,0,0,1,0,0,1,0,0,3,1,3,2,1,1,2,2,1,2,3,1,2010492,4,4,fear,"When we forced a friend to chew a poisonous herb in primary school.  His tongue was swollen and he told his mother about it.  The mother reported it to the headmaster who threatened to expel us.",1
331047,1,33,47,2,24,8,2,6,6,1,2,0,0,0,0,0,0,0,0,0,0,0,0,0,0,0,0,0,0,0,0,0,0,0,0,3310472,0,0,fear,[ No response.],1
331042,1,33,42,2,23,2,1,7,1,1,2,1,4,4,3,2,-1,1,0,0,1,0,0,2,1,3,3,3,3,1,1,1,1,0,3,3310422,4,4,fear,"The day the results of the certificate exam came out.  I went to school and at first I did not feel frightened.  By the time I reached the fourth floor ( the results were being given on the fifth floor) I found it difficult to walk and felt that I would die.",1
201031,1,20,31,1,31,2,2,8,8,2,2,4,4,4,3,0,-1,1,0,0,0,0,0,1,1,3,3,0,4,2,0,0,0,1,0,2010312,4,4,fear,"I was walking through a thick forest and there was a big snake at a distance of about four metres.",1
331053,1,33,53,2,24,2,2,7,1,1,2,4,1,4,3,0,0,1,0,0,1,0,0,1,1,0,2,3,1,1,3,2,2,0,1,3310532,1,4,fear,"When I was young I had gone to an old lift and played with the antique lift.  The guy discovered me and warned me, I was very frightened.",1
331059,1,33,59,2,25,2,2,7,1,1,2,4,4,4,1,1,0,2,0,0,1,0,1,1,1,3,0,1,0,1,1,3,3,0,2,3310592,4,4,fear,"At night when I was alone at home (all the family members usually get together at that time) someone knocked vigorously on the door.",1
201043,1,20,43,1,20,6,1,7,6,2,2,4,4,4,4,1,-1,4,0,0,1,0,2,3,1,3,3,1,4,2,0,3,0,1,2,2010432,4,4,fear,"The day I encountered a queer mamba face to face in a chunk of leaves behind our house.",1
