331060,1,33,60,2,20,7,1,5,7,1,3,3,3,2,0,1,0,1,0,0,1,0,0,1,1,3,3,3,0,3,3,3,2,2,2,3310603,3,2,anger,"The surname of my brother was different from ours.  He often grinned at home and provoked others for the pleasure of it.  This made me angry.",1
302064,1,30,64,1,20,8,0,7,6,8,3,1,1,3,2,0,0,2,0,0,0,0,0,1,2,3,2,3,2,5,2,2,1,2,0,3010643,1,3,anger,"Some foreign students playing loud music before the biology examn.",1
41051,1,4,51,2,21,1,1,7,1,1,3,4,1,1,2,0,0,2,-1,0,0,0,0,1,2,3,3,1,1,4,0,2,3,2,0,0410513,1,1,anger,When I quarelled with my parents.,1
301009,1,30,9,1,18,8,0,5,4,1,3,2,4,3,2,0,0,2,-1,0,0,0,0,1,1,3,2,3,3,1,3,2,3,3,0,3010093,4,3,anger,Saw in the TV South Korea cheating in the Asian Olympic games.,1
11081,1,1,81,2,21,0,2,6,0,1,3,2,1,1,0,0,0,2,0,0,0,0,1,1,1,2,2,3,0,0,1,2,3,3,0,0110813,1,1,anger,"My father and I had an argument because I do not help enough at home.",1
302061,1,30,61,1,20,8,0,5,6,2,3,1,4,3,1,0,0,1,-1,0,0,0,1,1,1,3,3,3,3,5,0,1,1,0,0,3010613,4,3,anger,"Your prejudice against psychology students and education students (not allowing us to go to the medical university lectures).",1
21009,1,2,9,2,21,1,2,8,1,9,3,4,1,2,1,0,0,2,0,0,0,0,1,1,2,0,0,0,4,4,2,0,0,1,0,0210093,1,2,anger,"Angry with my brother, who was making fun of me, teasing me.",1
21003,1,2,3,1,26,1,2,7,1,9,3,4,3,3,1,0,0,0,0,0,0,1,2,1,1,3,2,3,2,5,3,2,2,0,0,0210033,3,3,anger,"A drunken friend of mine was beating up another friend, who was also drunk.",1
11009,1,1,9,2,24,1,1,7,7,2,3,3,3,4,0,1,0,0,0,0,0,0,0,1,2,3,2,1,3,1,3,2,0,3,1,0110093,3,4,anger,"When I heard on the radio that the football match in Belgium had ended in a catastrophe, and several people had died.  I could not  understand how normal people could behave in such a way.",1
11014,1,1,14,1,23,0,0,7,4,2,3,1,1,2,1,0,0,1,0,0,0,0,1,2,2,3,3,2,2,2,2,2,1,0,0,0110143,1,2,anger,Mad at my dad.,1
41046,1,4,46,2,27,8,2,7,1,1,3,1,3,3,2,0,0,3,-1,0,0,0,1,1,1,3,3,2,4,4,1,2,1,1,0,0410463,3,3,anger,"My boy-friend came home late one night without having told me about it before.",1
21013,1,2,13,1,29,1,2,4,1,9,3,4,4,4,1,0,0,0,0,0,0,0,0,2,2,3,3,3,2,3,3,0,1,1,0,0210133,4,4,anger,"Being subject to unfair treatment in a working group, someone ""bending the rules"" was protected by the boss. This resulted in more work for the others.",1
301013,1,30,13,1,21,5,2,4,4,1,3,2,4,2,1,0,0,0,1,0,0,0,1,2,1,3,1,3,3,5,3,2,3,0,0,3010133,4,2,anger,Someone called me a disgusting nickname.,1
11011,1,1,11,1,25,1,2,7,6,2,3,3,3,2,3,0,0,1,0,0,0,0,1,1,2,0,0,1,3,4,2,3,0,2,0,0110113,3,2,anger,When I spoke to Jan-Erik Wikstr�m on the telephone.,1
11087,1,1,87,1,28,0,2,7,6,1,3,3,2,3,2,0,0,1,0,0,0,0,1,1,1,3,2,1,3,5,3,0,1,0,0,0110873,2,3,anger,The sight of a man who ran amok (fighting) at a dance.,1
11008,1,1,8,2,34,1,2,7,7,2,3,2,3,2,3,0,2,2,0,0,0,1,1,1,1,2,2,2,2,2,2,1,1,3,0,0110083,3,2,anger,"Unjust accusations directed at me and my way of acting, by someone close to me.",1
41058,1,4,58,2,20,1,2,7,5,1,3,2,3,2,0,0,0,0,0,0,0,0,0,1,2,3,2,2,2,3,2,2,2,0,0,0410583,3,2,anger,"An utterance, which I had intended to be a joke, was taken as an offence.  In my opinion, this was stupid, and I got angry.",1
302060,1,30,60,2,19,8,0,7,7,8,3,2,4,3,2,0,0,0,0,0,0,0,1,1,1,3,3,3,2,5,3,1,1,0,0,3010603,4,3,anger,Some boys deliberately played tricks on me in the experiments.,1
301012,1,30,12,2,22,8,0,7,4,8,3,1,4,4,2,0,2,1,0,0,0,0,2,1,1,3,2,1,2,5,1,1,3,0,0,3010123,4,4,anger,Overhear people talking about me and saying that I am stupid.,1
11088,1,1,88,2,30,0,2,2,6,1,3,4,4,4,2,0,0,1,0,0,0,1,2,1,1,3,3,3,3,5,3,0,1,0,0,0110883,4,4,anger,"With the job appointments committee when the headmaster in charge explained that a male teacher was more suitable for the particular post.  I had more years of service than the male teacher, but this was not taken into consideration.  I could have been given a less attractive job if things had gone the way the headmaster wanted.",1
41057,1,4,57,2,25,1,2,7,6,1,3,2,4,4,2,0,0,1,0,0,0,0,1,2,1,3,3,3,0,5,3,1,1,3,0,0410573,4,4,anger,"I was angry at my boyfriend who had promised to come to see me but did not because he spent the evening with his pals.",1
11010,1,1,10,1,24,0,2,6,6,2,3,3,4,3,2,0,0,1,1,0,0,0,0,2,2,3,3,1,3,5,1,1,1,1,0,0110103,4,3,anger,"At my Summer job, nobody looked after me in particular and I had to learn all on my own.",1
302066,1,30,66,2,20,8,0,7,6,8,3,1,2,3,2,0,0,2,0,0,0,0,0,1,1,3,3,3,2,5,3,2,1,3,0,3010663,2,3,anger,"Someone told me that I was chosen for English lectures because the class leader is going out with me (not true).",1
21014,1,2,14,2,26,1,2,5,1,9,3,1,1,2,1,0,2,2,-1,0,0,1,1,3,2,3,2,2,2,4,1,1,1,1,0,0210143,1,2,anger,"One of my best friends accused me of giving up to early on problems. It was only a casual remark on her side, but I was angry and hurt.",1
331055,1,33,55,2,26,2,2,0,1,1,3,4,1,1,0,1,0,0,1,0,0,0,0,3,1,3,1,1,1,4,1,3,3,1,1,3310553,1,1,anger,"My friend half-teasingly called me a bad nickname.  I felt insulted and kicked his hip in anger.  I was stable later and did not feel angry at him.  In fact I was afraid that the other friends who were with us would think that I was an intolerant person.  However I could not apologize, so I pretended that nothing had happened and smiled when I left.  My friend did not say anything but just watched me leave.",1
302059,1,30,59,2,19,8,0,7,6,2,3,2,4,4,2,0,0,0,0,0,0,0,1,1,1,3,3,3,3,5,3,1,1,1,0,3010593,4,4,anger,"Being sexually assulted on a bus and noone helped (people only laughed).",1
41054,1,4,54,2,19,1,2,8,6,1,3,3,3,1,1,1,0,2,-1,0,1,0,1,2,1,3,3,2,2,1,2,2,2,2,2,0410543,3,1,anger,"My parents put pressure on me to buy clothes, when I would not have liked to do so.",1
331051,1,33,51,2,23,2,2,0,7,1,3,3,4,4,2,0,2,0,0,0,0,0,0,1,2,3,1,3,2,5,3,1,1,2,0,3310513,4,4,anger,"My friend often played a joke on me and sometimes I thought that he was a nonsensical person. Once when we went to a friend's house he walked in first and shut the door firmly behind him.  I felt that he did not respect me and moreover I was his friend so he should not have behaved like that.  I was very angry (as it is I was in a bad mood then).",1
11083,1,1,83,1,27,8,2,7,4,1,3,1,1,4,2,0,0,1,0,0,0,0,1,1,3,2,3,3,2,1,3,2,1,1,0,0110833,1,4,anger,"A lady I live with had not bothered to clean up before she went   on holiday (I live in a collective).",1
301010,1,30,10,2,22,8,0,6,4,8,3,2,4,4,2,0,0,3,1,0,0,1,1,1,2,3,1,3,3,1,3,2,3,3,0,3010103,4,4,anger,South Korea cheating for gold medals.,1
11007,1,1,7,2,35,0,2,0,8,2,3,2,4,4,3,0,2,0,0,0,0,1,1,1,1,3,3,3,3,5,3,3,0,3,0,0110073,4,4,anger,When my partner was attacked and lost three teeth.,1
301014,1,30,14,2,21,0,0,7,6,8,3,2,4,3,2,1,2,1,0,0,0,0,0,2,1,3,2,3,2,1,3,2,2,0,1,3010143,4,3,anger,A friend forgot his appointment with me.,1
11013,1,1,13,2,22,1,2,7,4,2,3,1,1,3,1,0,0,3,0,0,0,0,0,1,1,3,0,3,3,4,3,2,1,1,0,0110133,1,3,anger,"At work, when an elderly man complained unjustifiably about me and distrusted me.",1
41055,1,4,55,2,20,1,2,4,1,1,3,3,4,3,4,0,2,2,0,0,0,0,2,2,1,3,3,3,4,1,0,2,1,0,0,0410553,4,3,anger,"Disagreements with mother.  When I moved from KankaanpSS, she had promised to help me move but broke her promise because of some hindrance.",1
302065,1,30,65,2,20,8,0,7,5,2,3,4,2,3,0,0,0,1,-1,0,0,0,1,1,2,3,3,3,2,5,2,2,1,0,0,3010653,2,3,anger,Quarreling with classmates.,1
21016,1,2,16,1,22,8,2,2,2,9,3,2,1,2,0,0,0,0,0,0,0,0,0,1,1,3,3,3,3,4,3,2,1,2,0,0210163,1,2,anger,"I felt unfairly treated at an airport, being told to use a different counter (for domestic traffic only).",1
21001,1,2,1,2,21,1,2,5,1,9,3,2,1,3,1,0,2,1,-1,0,0,0,2,1,2,3,3,3,2,5,0,1,1,3,0,0210013,1,3,anger,"Someone didn't show up at a meeting in spite of having agreed to come.",1
41059,1,4,59,2,20,1,1,5,6,1,3,4,3,3,2,0,0,3,0,0,0,0,1,1,1,3,3,3,0,5,1,3,3,0,0,0410593,3,3,anger,"I got angry at a friend of mine whom I caught reading my notebook (almanach).",1
302067,1,30,67,2,23,8,0,6,5,3,3,2,4,3,1,0,2,0,0,0,0,0,0,1,1,3,1,3,2,4,1,3,1,0,0,3010673,4,3,anger,My best friend betrayed me and told other people my secrets.,1
21015,1,2,15,2,27,8,0,5,7,9,3,3,3,3,3,0,0,1,1,0,0,0,2,1,1,3,2,3,0,5,2,2,0,0,0,0210153,3,3,anger,"I was subject to false accusations, and got very angry.",1
11012,1,1,12,1,23,1,2,7,6,2,3,1,2,3,2,0,0,1,0,0,0,0,0,1,1,2,0,0,1,4,1,2,2,2,0,0110123,2,3,anger,I locked myself out.,1
11086,1,1,86,1,24,1,2,0,6,2,3,0,0,0,0,0,0,0,0,0,0,0,0,0,0,0,0,0,0,0,0,0,0,0,0,0110863,0,0,anger,[ No response.],1
331057,1,33,57,2,21,2,2,7,0,1,3,4,4,3,2,1,0,2,0,0,1,0,1,1,1,3,3,3,0,1,2,3,1,1,2,3310573,4,3,anger,Someone spread rumours about me.,1
331053,1,33,53,2,24,2,2,7,1,1,3,4,4,3,2,2,2,3,-1,0,1,0,1,1,1,3,3,3,2,1,3,1,1,2,3,3310533,4,3,anger,"Whenever my father smokes the smell makes me feel very uncomfortable.  He never listens to my complaints and I curse him furiously in my mind.  I cannot solve this problem by violence because of traditional moral values.",1
41047,1,4,47,2,21,1,2,7,7,2,3,0,0,0,0,0,0,0,0,0,0,0,0,0,0,0,0,0,0,0,0,0,0,0,0,0410473,0,0,anger,"When I heard that my step-mother had treated my mother in a wrong manner.",1
301017,1,30,17,1,20,8,0,4,4,1,3,1,2,3,0,1,0,2,0,0,0,0,0,3,1,3,2,3,2,5,1,2,2,0,1,3010173,2,3,anger,I was told to do something I did not want to do.,1
11023,1,1,23,1,25,8,2,7,5,2,3,2,2,3,1,1,0,1,-1,0,0,0,0,2,0,3,0,1,3,1,0,2,2,0,1,0110233,2,3,anger,"On the T.V I saw a news feature on South Africa.  A policeman      attacked a group of black people with a whip.",1
302080,1,30,80,2,24,8,0,7,5,8,3,3,3,2,0,0,2,2,0,0,0,0,1,1,1,3,1,3,3,1,1,2,2,3,0,3010803,3,2,anger,"My parents do not like my friend and told me to stay away from him.",1
331061,1,33,61,2,26,1,1,9,7,1,3,3,4,4,0,0,0,3,1,1,1,0,0,3,2,3,3,3,2,0,1,2,1,1,1,3310613,4,4,anger,"In September 1984, I was forced to live with someone I did not like.  The first week we were at loggerheads and our conversation was like a debate.  The atmosphere was very bad.  When he learnt that I had got 95 marks in a test he told me "" A failure, You lost 5 marks.""   I was very angry, not because my marks were lower than his, but because I could not tolerate his pride.  I did not show my discontentment and carried on doing my work.",1
41048,1,4,48,2,22,1,2,5,6,2,3,2,2,3,2,0,0,2,0,0,0,0,0,1,2,3,0,3,3,1,0,2,1,0,0,0410483,2,3,anger,"In a tram, the ticket seller was commanding, taking the role of a leader, trying to emphasize her non-existent authority with undue strictness towards a good-humoured drunk who could not find his ticket at once.",1
21019,1,2,19,2,22,8,2,6,6,9,3,2,4,2,0,0,0,0,0,0,0,1,0,1,2,0,1,2,0,5,0,2,2,3,0,0210193,4,2,anger,"A close friend first said he accepted an agreement, but later used that agreement as a reason for attacking me.",1
11001,1,1,1,1,33,1,2,6,1,2,3,4,1,3,0,0,0,2,0,0,0,0,1,1,1,3,3,0,3,1,2,2,1,0,0,0110013,1,3,anger,"When I was driving home after  several days of hard work, there was a motorist ahead of me who was driving at 50 km/hour and refused, despite his low speeed to let me overtake.",1
331048,1,33,48,2,24,7,2,9,1,1,3,4,4,3,1,0,0,0,0,0,0,0,0,2,1,3,2,3,2,1,3,2,1,0,0,3310483,4,3,anger,"When I got into a bus I found that my wallet had been stolen. It was not a great loss from the monetary point of view but I lost some documents - identity papers.  As a result I had to spend several days in order to get a new one.  I will always remember all the work I had to do and the bad treatment I suffered because of the bureaucratic behaviour of the civil servant.  I had already had bad luck and they treated me like a criminal.   At one point of time I really wanted to quarrel with them.",1
41049,1,4,49,2,21,8,2,7,7,3,3,3,1,4,4,0,0,1,0,0,0,0,1,3,2,3,2,3,3,1,1,2,1,2,0,0410493,1,4,anger,"A male, Honduran acquaintance of mine despised my opinions.",1
41070,1,4,70,2,28,1,2,6,6,1,3,1,2,4,3,2,2,2,0,0,0,0,2,1,1,3,3,3,3,5,3,3,2,0,2,0410703,2,4,anger,"I was on vacation, and therefore I did not attend a meeting of the day care centre.  Nevertheless, the very day I came back they called me early morining to ask me ""what are you going to do about the matter ?"" (which had been discussed in the meeting).  Then I got angry.",1
11003,1,1,3,2,22,8,2,4,6,2,3,3,4,4,4,1,0,2,0,0,1,0,2,2,1,3,3,3,2,1,0,1,1,2,2,0110033,4,4,anger,"When I had been obviously unjustly treated and had no possibility of elucidating this.",1
11021,1,1,21,2,30,1,2,4,1,2,3,3,3,3,0,0,0,0,0,0,0,0,0,3,2,2,2,0,2,4,2,2,1,1,0,0110213,3,3,anger,"When a colleague asked me for help at work, despite the fact that he had more time to do it than I had.",1
302063,1,30,63,2,22,8,0,7,7,2,3,1,2,3,1,0,0,1,0,0,0,0,0,1,1,3,2,3,2,5,2,2,1,3,0,3010633,2,3,anger,Misunderstood by friends.,1
21020,1,2,20,2,19,1,2,8,8,9,3,2,4,4,0,1,2,2,0,0,1,1,1,1,3,3,1,0,0,1,3,3,1,3,2,0210203,4,4,anger,"When I tried to breake it up with my boyfriend, and he refused to let me go.",1
331062,1,33,62,2,21,2,1,7,7,1,3,1,1,2,2,0,0,2,0,0,0,1,0,1,1,3,2,1,2,5,1,2,2,3,0,3310623,1,2,anger,"Two years back someone invited me to be the tutor of her grand-daughter.  The grand-daughter asked me some questions in mathematics so I taught her.  However she did not listen to me and this made me feel unhappy.  The second year it was the same.  When I entered university the girl's parents suggested that I be employed as their daghters tutor.  They told me that at university  there was no homework and I would have a lot of time so they made a time-table  for me which required me to be the tutor five days a week.  They did not respect me and anyway I had another child to teach.",1
11079,1,1,79,1,28,0,2,4,1,2,3,3,2,2,0,0,0,1,0,0,0,0,1,0,1,3,2,3,2,4,3,2,1,0,0,0110793,2,2,anger,A girl I was with went off with another guy.,1
331049,1,33,49,2,23,8,2,5,8,1,3,4,4,3,0,0,0,1,0,0,0,0,1,1,1,3,1,1,3,5,1,2,1,0,0,3310493,4,3,anger,"The day the results of the Chinese university was announced I should have been very happy; however my grandmother, because of  her prejudice and misunderstanding, started a  quarrel with my mother.  She expected me to take her side and she deliberately talked of my mother's wrong doings.  I was very angry because - one my grandmother was not being reasonable and two because it should have been a happy day and three we had moved into a new house that day.",1
302062,1,30,62,1,21,8,0,6,6,8,3,1,4,3,2,0,0,2,0,0,0,0,0,1,1,3,3,3,3,5,0,1,1,2,0,3010623,4,3,anger,Being insulted in public for the wrong reason.,1
301018,1,30,18,2,21,8,0,6,5,8,3,2,1,4,3,0,2,1,0,0,0,0,0,2,1,3,3,2,3,5,1,1,1,0,0,3010183,1,4,anger,Insulted by teacher.,1
301008,1,30,8,1,21,8,0,7,6,8,3,2,4,4,3,0,2,2,0,0,0,0,2,1,1,3,2,3,3,5,1,2,2,0,0,3010083,4,4,anger,Bus conductor insulted me for not buying a ticket (I forgot).,1
21004,1,2,4,1,22,1,2,7,6,9,3,3,4,4,3,1,0,1,1,0,0,0,1,1,2,3,3,3,0,5,2,3,2,2,1,0210043,4,4,anger,"My mother and her friends were speaking badly about my father when they were separated, and my brothers and sisters and myself were allowed to listen.",1
301007,1,30,7,1,18,8,0,5,5,1,3,1,1,4,3,0,2,2,0,0,0,0,2,1,1,3,1,1,1,5,1,1,2,0,0,3010073,1,4,anger,"I could not find my monthly tickets for the bus when I was on the bus.",1
302079,1,30,79,2,20,8,0,7,7,1,3,4,4,4,0,1,0,1,0,0,1,0,1,1,1,2,2,3,0,1,0,2,2,0,2,3010793,4,4,anger,Being insulted on a bus.,1
41069,1,4,69,2,34,1,2,4,6,2,3,2,3,4,2,0,2,3,1,0,0,1,2,1,1,3,3,0,2,1,3,2,2,3,0,0410693,3,4,anger,"Without my permission, my son had made popcorn after coming back from school.  The consequences were a spoilt kettle and chaos in the kitchen but what could have happened with the hot grease ?",1
302056,1,30,56,2,21,8,0,7,7,8,3,2,1,3,1,0,2,1,0,0,0,0,0,1,1,1,2,3,3,5,1,2,2,2,0,3010563,1,3,anger,Insulted by other people in the shop.,1
11077,1,1,77,2,22,0,2,4,6,2,3,0,3,4,2,0,0,2,0,0,0,0,1,1,2,3,1,3,2,5,1,1,0,0,0,0110773,3,4,anger,"My parents did not approve my choice of a boyfriend (now an ex-boyfriend).  He happened to be 13 years older than me and he was considered completely unsuitable for me.  IDIOT.",1
11022,1,1,22,1,24,1,2,8,4,2,3,2,2,2,2,0,0,0,0,0,0,0,0,1,2,3,2,2,3,1,0,2,1,3,0,0110223,2,2,anger,"The editor changed the heading of an article that I had written.  He considered the heading to be derogatory towards the person I had written about.",1
21006,1,2,6,1,28,1,2,4,1,9,3,4,0,4,3,0,2,0,-1,0,0,0,0,3,3,3,3,0,3,0,3,2,0,1,0,0210063,0,4,anger,Meeting generally dominating persons in social occasions.,1
11078,1,1,78,2,24,1,2,2,4,2,3,2,3,2,0,0,0,0,0,0,0,0,0,1,1,0,3,0,2,0,3,0,1,0,0,0110783,3,2,anger,"There was a sofa in my flat which belonged to the old tenants who were acquaintances.  It should have been picked up a year ago but they had postponed it.  Eventually they decided on one date and I stayed at home despite the fact that I had other things to do.  They did not come, nor did they call and they still have not got in touch with me.",1
11020,1,1,20,1,24,8,2,4,4,2,3,1,3,3,0,0,0,0,0,0,0,0,0,1,1,3,3,0,4,1,0,2,2,0,0,0110203,3,3,anger,"When I got caught in the pouring rain last Thursday and did not have a raincoat on me.",1
11002,1,1,2,2,23,0,0,7,5,2,3,3,3,4,2,0,0,2,0,0,0,1,2,1,1,2,3,0,2,1,3,2,1,3,0,0110023,3,4,anger,When I was talking to HIM at a party for the first time in a long while and a friend came and interrupted us and HE left.,1
11004,1,1,4,1,23,8,2,6,4,2,3,2,1,4,2,0,0,1,0,0,0,0,1,1,3,1,2,3,3,4,3,3,1,0,0,0110043,1,4,anger,"When a car is overtaking another and I am forced to drive off the road.",1
41064,1,4,64,2,25,1,2,6,1,2,3,2,3,3,2,2,0,1,1,0,0,0,0,2,1,3,3,3,3,1,1,1,0,0,2,0410643,3,3,anger,"When I saw a big man hit another one, and nobody did anything.",1
21005,1,2,5,1,26,1,0,8,8,9,3,2,1,1,1,0,0,1,0,0,0,0,2,2,2,2,2,2,3,5,0,2,0,0,0,0210053,1,1,anger,"I was accused of a misdemeanour, unjustly.",1
21007,1,2,7,2,33,2,2,8,1,9,3,3,4,4,3,0,2,2,0,0,0,0,1,1,2,3,1,3,2,1,3,3,1,3,0,0210073,4,4,anger,"When my father phoned me to come home from my vacation, since he no longer had the time to look after my garden and animals.",1
191015,1,19,15,1,20,2,2,7,1,5,2,4,1,3,3,1,0,0,-1,0,0,0,1,1,3,3,3,1,1,4,1,2,2,1,1,1910152,1,3,fear,Every time I went home with my school report.,1
81054,1,8,54,2,22,2,2,8,6,1,2,1,3,4,4,2,-1,5,-1,0,1,0,2,3,1,0,3,3,4,2,1,1,1,0,3,0810542,3,4,fear,"I lived in a flat with a couple. The woman was so jealous of me, that she sometimes had crying fits. Eventually her husband could not stand that any more and wanted to kill me.",1
91106,1,9,106,2,18,1,2,6,5,8,2,3,4,3,3,1,0,0,1,0,0,0,1,1,1,3,0,3,4,1,3,2,2,0,1,0911062,4,3,fear,"Car accident nearly occurred between us and drunk driver coming in opposite direction it missed us by approx 1 m and collided (after rolling twice midair) into nearby scrub.",1
81023,1,8,23,2,18,1,2,8,1,1,2,3,3,4,3,0,2,2,0,0,1,0,0,1,1,3,0,0,1,1,0,2,2,0,1,0810232,3,4,fear,"I was at home alone and my mother had asked me to heat the house. I put too much fuel into the stove. It began to glow and there was a noise in the whole house as if it was going to explode.",1
201018,1,20,18,1,20,2,2,8,1,2,2,4,4,4,3,1,2,1,0,0,0,0,1,2,1,3,1,1,4,5,0,3,3,0,1,2010182,4,4,fear,"It was when I dreamt that I had encountered Satan, he wanted to grab me and take me to his kingdom.  He was very repulsive and I have never seen anything like that before.",1
201022,1,20,22,1,20,7,1,6,1,2,2,3,1,4,4,1,-1,3,1,0,0,0,2,1,1,2,2,0,4,4,0,0,0,0,1,2010222,1,4,fear,When I saw a ghost.,1
41049,1,4,49,2,21,8,2,7,7,3,2,3,3,3,4,0,-1,1,-1,0,0,0,0,3,2,3,2,1,4,3,0,3,3,0,0,0410492,3,3,fear,"Traveling as the only female in a railway carriage in the middle of the night in Italy.",1
191073,1,19,73,2,19,2,1,8,1,1,2,4,3,4,4,0,0,3,0,0,1,0,2,3,2,3,3,0,1,1,3,1,0,0,1,1910732,3,4,fear,"I was in a camp and went out for a walk at night on my own.  I lost  my way and spent several hours looking for the camp.",1
191014,1,19,14,1,21,2,2,4,1,5,2,1,1,2,0,1,0,1,0,0,0,0,0,3,1,3,2,3,3,4,3,1,2,0,1,1910142,1,2,fear,When I go out alone at night.,1
41050,1,4,50,2,26,1,2,5,5,9,2,3,4,2,3,1,0,1,0,0,1,0,0,2,2,2,1,2,1,5,1,3,2,3,2,0410502,4,2,fear,"While preparing my master's thesis, I was scared that I would not accomplish anything as the subject was rather difficult.",1
81059,1,8,59,2,25,2,1,6,1,1,2,2,2,3,2,1,-1,0,0,0,0,0,0,0,2,3,2,2,4,2,0,2,0,0,1,0810592,2,3,fear,"When I had to go through lonely streets in the middle of the night.",1
191020,1,19,20,2,20,2,2,4,1,5,2,3,4,4,1,0,0,1,0,0,0,0,0,1,1,3,1,3,3,1,3,0,1,1,0,1910202,4,4,fear,"When I was attending an authorized demonstrationand the police rushed brutally at the demonstrators, without any warning.",1
11070,1,1,70,2,28,1,1,6,6,2,2,2,2,3,2,2,-1,1,0,0,0,0,0,2,0,3,3,0,1,1,0,2,2,0,2,0110702,2,3,fear,When someone close to me is travelling by car and is delayed.,1
81058,1,8,58,2,23,2,2,7,1,1,2,3,3,3,2,1,-1,2,-1,0,0,0,0,2,3,3,3,0,1,5,0,1,0,0,1,0810582,3,3,fear,"When I had my first oral examination after a long time; especially one day before the examination when I had the feeling that I had not studied enough and had not enough time to make up for it.",1
11004,1,1,4,1,23,8,2,6,4,2,2,4,4,4,0,0,0,0,-1,0,0,0,0,3,3,3,1,1,1,3,0,2,0,0,0,0110042,4,4,fear,"When, for the first time I realized the meaning of death.",1
41053,1,4,53,2,20,1,2,0,4,1,2,2,2,4,1,2,-1,3,0,0,0,0,0,1,1,3,3,0,1,5,2,1,1,0,2,0410532,2,4,fear,"My boyfriend hinted over the phone about wanting to ""be free"".  He thus did not say it point blank, silence followed.",1
11066,1,1,66,1,32,8,0,4,6,2,2,1,1,3,3,0,0,1,0,0,0,0,1,2,1,3,0,1,3,1,1,0,1,0,0,0110662,1,3,fear,"When I was cycling to school, I nearly got knocked down by a car which (overtook me too closely) did not give me any swerving space.",1
191017,1,19,17,2,20,2,2,4,1,5,2,1,1,2,0,0,0,0,0,0,0,0,0,1,3,2,2,0,0,4,2,0,0,0,0,1910172,1,2,fear,"Fights that I see in the middle of the street, robberies, fear of darkness when going home.",1
191062,1,19,62,2,21,2,2,4,1,1,2,1,1,2,0,1,0,0,0,0,0,0,0,2,1,3,2,1,2,4,1,2,2,0,1,1910622,1,2,fear,When a friend of mine told me a horror story.,1
91107,1,9,107,2,18,1,2,8,8,3,2,3,1,2,1,0,0,1,0,0,0,0,0,1,1,3,3,0,4,1,1,2,2,0,0,0911072,1,2,fear,"Small car accident. Black ice on the road - cars in front of us started zig-zagging and so did we. Car in front did a 180� turn we followed and ended up in a gully.",1
11005,1,1,5,2,22,1,1,7,6,2,2,3,1,2,1,0,2,1,0,0,0,0,1,1,2,3,2,2,4,3,0,2,2,0,0,0110052,1,2,fear,"When one has arranged to meet someone and that person arrives late, in the meantime one starts thinking about all that could have gone wrong e.g a traffic accident.",1
41038,1,4,38,2,19,1,2,7,7,1,2,4,4,2,3,1,0,1,0,0,0,0,3,3,2,3,0,3,1,2,1,3,1,3,1,0410382,4,2,fear,"At school, I had acted against the will of the group, and the next day they promised to take revenge on me.",1
201020,1,20,20,1,20,6,1,8,1,3,2,4,3,3,4,0,-1,1,-1,0,1,0,1,0,1,3,3,3,4,5,3,1,1,2,1,2010202,3,3,fear,"This was at secondary school, a prefect framed up some case and took it to the deputy head-master.  I was called by the head-master and he threatened to suspend me.",1
191018,1,19,18,2,19,2,1,5,1,5,2,3,1,4,3,1,0,1,0,0,0,0,1,2,1,3,0,1,4,1,0,0,0,2,1,1910182,1,4,fear,"There was an earthquake for several minutes and I was on the eight floor.",1
81003,1,8,3,1,22,2,1,7,6,1,2,3,4,2,0,0,0,2,0,0,0,0,0,2,2,3,2,0,4,3,0,0,3,0,0,0810032,4,2,fear,"My sister had to undergo a very complicated operation, her eyesight was at stake.",1
81056,1,8,56,1,22,1,1,6,1,1,2,3,3,3,4,1,-1,2,-1,0,0,1,0,3,3,3,1,1,1,1,1,1,2,0,1,0810562,3,3,fear,"Before I went to the urologist's I was afraid for several reasons: because it was for the first time, because the medical check-up might be painful, because of the uncertainty and because someone had informed me about it.",1
11067,1,1,67,1,30,1,2,2,6,2,2,3,2,2,1,1,0,1,0,0,0,0,0,1,1,3,2,3,4,1,1,2,1,2,1,0110672,2,2,fear,Was nearly knocked down by a car.,1
201024,1,20,24,2,19,1,1,2,6,5,2,1,3,4,1,0,0,0,0,0,0,0,0,3,1,3,3,0,1,1,0,0,0,0,0,2010242,3,4,fear,"I watched a very terrfying film in LT2.  This film really pushed my heart out of my body and I was forced to go out before the second reel ended.",1
201019,1,20,19,1,20,6,1,8,8,5,2,4,4,4,0,1,-1,1,0,0,0,0,0,2,1,3,3,3,4,2,3,1,2,1,1,2010192,4,4,fear,"I was escorting a relative on a bike, we passed by a dark road with bushas on each side.  Half way down this road, suddenly, we   saw a white dog appear from one side.  Before we could do anything, it had vanished and moreover it did not seem to have any legs.",1
41063,1,4,63,2,20,1,2,7,7,1,2,3,1,4,4,0,2,0,-1,0,0,0,0,3,2,3,2,1,1,1,1,1,1,0,0,0410632,1,4,fear,"One evening, while going to meet a friend of mine, I had to cross a meadow by a dark road.  There were bushes on the other side of the road.  The weather was damp and a bit foggy.  I heard steps behind me and kept speeding up my steps all the time.",1
81024,1,8,24,2,19,2,1,9,6,1,2,4,2,2,1,0,0,0,-1,0,0,0,0,2,1,3,0,0,4,2,0,0,0,0,0,0810242,2,2,fear,"When I was a child I was afraid of big dogs. One day when I came home a big dog was laying in front of our door. I was so frightened that I did not dare to enter the door and I waited until somebody passed by.",1
41064,1,4,64,2,25,1,2,6,1,2,2,1,4,4,2,2,0,2,-1,0,1,0,1,1,1,3,2,0,2,1,1,0,0,3,3,0410642,4,4,fear,"I saw a man who had had a heart-attack and who was being treated for it.  I feared that my own father could have been there.",1
191063,1,19,63,2,21,8,2,2,1,1,2,2,1,3,3,0,0,1,0,0,0,0,0,1,1,3,2,3,3,3,3,2,2,0,0,1910632,1,3,fear,"We were on the road in a car when a lorry bypassed us.  We had to swerve and we almost got run over.",1
11020,1,1,20,1,24,8,2,4,4,2,2,3,2,3,0,1,0,0,0,0,0,0,0,2,2,3,2,3,0,4,0,2,3,0,1,0110202,2,3,fear,When my father was ill and was waiting for the results of his tests.,1
191019,1,19,19,2,20,2,1,6,1,5,2,3,3,3,0,0,0,0,0,0,0,0,0,3,1,3,3,3,3,5,2,2,1,0,0,1910192,3,3,fear,When they tried to rob me.,1
81002,1,8,2,2,21,1,2,6,6,1,2,4,2,4,3,0,-1,2,1,0,1,0,2,1,1,3,2,3,4,1,0,2,0,0,1,0810022,2,4,fear,Car accident in the middle of the night.,1
81057,1,8,57,1,20,2,1,7,6,1,2,3,3,3,1,2,0,1,0,0,0,0,0,3,2,3,0,0,0,1,0,0,0,0,2,0810572,3,3,fear,I was afraid before I went to the doctor's.,1
201021,1,20,21,1,35,1,1,5,1,5,2,4,2,3,1,0,0,1,0,0,0,0,0,1,3,3,2,1,4,2,0,3,0,0,0,2010212,2,3,fear,While paddling in the river during a storm.  I feared drowning.,1
